<?xml version="1.0" encoding="UTF-8"?>
<!ELEMENT students (student+)>
<!ELEMENT student (rollno,name,enrollmentno)>
<!ELEMENT rollno (#PCDATA)>
<!ELEMENT name (#PCDATA)>
<!ELEMENT enrollmentno (#PCDATA)>